{
  "schema_version": 1,
  "record_kind": "commit",
  "report_id": "frontend-architecture-and-baseline-2026-10-01",
  "title": "Frontend architecture and observed baseline",
  "author": "Bijan Mousavi",
  "prepared_at_utc": "2026-10-01T19:49:08Z",
  "parent_sha": "18043685a2e3d8048e1b7005fe98f02b0d0f0ea5",
  "candidate_sha256": "c8137b6511b6edd3e17a2661bde49413682442e065a97415c5977c9d93b95cb5",
  "fingerprint_algorithm": "bia-git-candidate-sha256-v1",
  "why": "Give reviewers an accurate map of the existing frontend, preservation boundaries and measured results before proposing behavior or deployment changes.",
  "what": "Document build/server/browser boundaries, all 45 source pages and 21 configured redirects, public configuration, observed baseline results and a concise team presentation.",
  "how": "Trace checked-out source, link each boundary to its implementation, compare the exported staged payload with the immutable application baseline, and distinguish measured results from unverified behavior.",
  "where": [
    "docs/architecture.md",
    "docs/reference/routes-and-configuration.md",
    "docs/engineering/baseline.md",
    "docs/engineering/team-review.md",
    "docs/README.md; README.md"
  ],
  "preserved": "Application source, public assets, dependencies, adapters, chart interfaces and existing CI remain byte-identical to the recorded upstream application baseline.",
  "risk": "A source inventory is not runtime coverage. Several configured redirect targets have no matching page file. Documentation records this observation without prescribing a behavior repair.",
  "limitations": "No new browser, viewer, platform or remote CI result. Baseline live-service build results are historical observations. Inherited advisories and maintainer licensing questions remain unresolved.",
  "rollback": "Revert this documentation change in a new reported commit. Contributor and report tools remain usable; application inputs are unaffected.",
  "checks": [
    {
      "gate": "Docs and source",
      "command": "python3 -B artifacts/admission/architecture/check_documentation.py artifacts/admission/architecture/candidate",
      "result": "PASS",
      "duration_seconds": 4.455,
      "exit_code": 0,
      "evidence_ref": "artifacts/admission/architecture/documentation-check.json",
      "required": true
    }
  ],
  "remote_status": "NOT_RUN"
}
