{
  "schema_version": 1,
  "record_kind": "commit",
  "report_id": "20261001-210513-local-admission",
  "author": "Bijan Mousavi",
  "prepared_at_utc": "2026-10-01T21:05:13Z",
  "parent_sha": "270a1f1373c636e234f5ceca81e7ba30bb9d5a54",
  "candidate_sha256": "ebf0a28bbff830fe20e744c656b37167553bbce1eb2a9c1107452581a0ee4640",
  "fingerprint_algorithm": "bia-git-candidate-sha256-v1",
  "checks": [
    {
      "gate": "Toolchain",
      "command": "npm run doctor",
      "result": "PASS",
      "duration_seconds": 0.388,
      "exit_code": 0,
      "evidence_ref": "artifacts/admission/20261001-210513-local-admission/results.json",
      "required": true
    },
    {
      "gate": "Developer tests",
      "command": "npm test",
      "result": "PASS",
      "duration_seconds": 1.731,
      "exit_code": 0,
      "evidence_ref": "artifacts/admission/20261001-210513-local-admission/results.json",
      "required": true
    },
    {
      "gate": "Report tools",
      "command": "npm run report-test",
      "result": "PASS",
      "duration_seconds": 5.812,
      "exit_code": 0,
      "evidence_ref": "artifacts/admission/20261001-210513-local-admission/results.json",
      "required": true
    },
    {
      "gate": "Staged controls",
      "command": "npm run verification-test",
      "result": "PASS",
      "duration_seconds": 7.063,
      "exit_code": 0,
      "evidence_ref": "artifacts/admission/20261001-210513-local-admission/results.json",
      "required": true
    },
    {
      "gate": "Index hygiene",
      "command": "git diff --cached --check",
      "result": "PASS",
      "duration_seconds": 0.021,
      "exit_code": 0,
      "evidence_ref": "artifacts/admission/20261001-210513-local-admission/results.json",
      "required": true
    }
  ],
  "remote_status": "NOT_RUN",
  "title": "Admission tied to completed staged checks",
  "why": "A readable report cannot authorize a commit unless its exact staged payload actually passed the required checks.",
  "what": "Add preparation, concurrent bounded gate execution, receipt-based report generation and staged triplet/trailer freshness checks.",
  "how": "Freeze parent and payload, collect every process result, generate twice from real completed receipts, then compare the staged bytes and commit trailer. Unknown application scope includes both adapter builds.",
  "where": [
    "scripts/verification/",
    "tests/verification/",
    "package.json; Makefile; makes/reports.mk",
    "reports/README.md"
  ],
  "preserved": "Original application commands, source, lock, assets, adapters and deployment are unchanged. Preparation and finalization never stage or commit automatically. Prior report identities stay intact.",
  "risk": "Local receipts are contributor evidence and cannot replace independent CI. TeX has no shell escape but requires an isolated secret-free environment for untrusted contributions.",
  "limitations": "13 developer, 57 report and 20 verification tests passed on the frozen index. This tooling-only candidate required no application build. No browser, viewer, platform or remote CI claim.",
  "rollback": "Revert admission tools and aliases together in a new reported commit. Preserve failed attempt evidence and the existing export/report utilities."
}
